{
  "$schema": "https://json-schema.org/draft/2020-12/schema",
  "$id": "https://company-harness.local/schema/case",
  "title": "Fall",
  "description": "Eingangsreiz, kontextfreie und kontextgefüllte Mengenangabe, Störungen. Der erwartete Wert liegt in einer eigenen Datei, damit ein Lauf ihn nicht sieht.",
  "type": "object",
  "additionalProperties": false,
  "required": [
    "id", "process", "synthetisch", "eingang", "erwartet",
    "kontext_a", "kontext_b", "stoerungen", "start_zustand"
  ],
  "properties": {
    "id": { "type": "string", "pattern": "^(CHANGE|BILL)-[0-9]{2}$" },
    "process": { "type": "string", "pattern": "^[a-zäöüß0-9]+(-[a-zäöüß0-9]+)*$" },
    "synthetisch": { "const": true },
    "eingang": { "type": "string", "description": "Dateiname des Eingangstexts im Fallordner." },
    "erwartet": { "type": "string", "description": "Dateiname des vorab notierten Ergebnisses. Darf einem Lauf nicht übergeben werden." },
    "kontext_a": {
      "type": "array", "maxItems": 0,
      "description": "Bedingung A: bewusst leer. Nur der Eingangstext, kein Unternehmenskontext."
    },
    "kontext_b": {
      "type": "array", "minItems": 1,
      "items": { "type": "string" },
      "description": "Bedingung B: die freigegebenen Kontextdatensätze. Jeder muss diesen Fall in seinem scope tragen."
    },
    "stoerungen": {
      "type": "array",
      "items": { "enum": ["evidenz-nach-freigabe-geaendert", "freigabe-verweigert", "dokument-fehlt", "zugriff-entzogen", "aktion-wiederholt"] }
    },
    "start_zustand": {
      "type": "object", "additionalProperties": false, "required": ["zustand"],
      "properties": {
        "zustand": { "enum": ["neu", "gesichtet", "blockiert", "wartet-auf-eigentümer"], "description": "Nur was ein Fall beim Anlegen haben kann. Die übrigen Zustände der Zustandsmaschine entstehen im Lauf." },
        "bemerkung": { "type": "string" }
      }
    },
    "hinweis_pruefer": { "type": "string" }
  }
}
